{
  "$schema": "../schemas/provider-catalog.schema.json",
  "schemaVersion": "starter-provider-catalog/v1",
  "catalogVersion": "1.0.0",
  "policy": {
    "noneForOptional": true,
    "selectableRequiresExecutable": true,
    "credentialsAreWriteOnly": true,
    "verificationIsExplicit": true
  },
  "categories": [
    {
      "id": "database", "name": "Database", "kind": "provider", "required": true, "selection": "single", "defaultOptionIds": ["native-postgresql"], "capabilityIds": ["identity.core"],
      "options": [
        { "id": "native-postgresql", "name": "Native PostgreSQL + Hyperdrive", "status": "development-verified", "delivery": "baseline", "selectable": true, "credentials": ["DATABASE_URL", "STARTER_PRODUCTION_DATABASE_URL"], "bindings": ["HYPERDRIVE"], "dependencies": ["pg"], "verification": { "available": true, "mode": "live-binding" }, "setupLinks": ["https://developers.cloudflare.com/hyperdrive/"], "notes": "SQL-first default with isolated Development and Production databases." },
        { "id": "cfpg", "name": "CFPG / All2CF Database", "status": "implemented", "delivery": "materializer", "selectable": true, "credentials": [], "bindings": ["ALL2CF_DATABASE"], "dependencies": ["@all2cf/database-connect"], "verification": { "available": true, "mode": "contract" }, "setupLinks": ["https://app.all2cf.com/"], "notes": "Requires distinct validated Development and Production connection commands before materialization." }
      ]
    },
    {
      "id": "authentication", "name": "Authentication", "kind": "provider", "required": true, "selection": "single", "defaultOptionIds": ["better-auth"], "capabilityIds": ["identity.core"],
      "options": [
        { "id": "better-auth", "name": "Better Auth", "status": "development-verified", "delivery": "baseline", "selectable": true, "credentials": ["BETTER_AUTH_SECRET"], "bindings": [], "dependencies": ["better-auth"], "verification": { "available": true, "mode": "contract" }, "setupLinks": ["https://better-auth.com/docs"], "notes": "Required identity/session authority for the SaaS foundation." }
      ]
    },
    {
      "id": "social-auth", "name": "Social sign-in", "kind": "provider", "required": false, "selection": "multiple", "defaultOptionIds": ["google"], "capabilityIds": ["identity.core"],
      "options": [
        { "id": "none", "name": "None", "status": "implemented", "delivery": "baseline", "selectable": true, "credentials": [], "bindings": [], "dependencies": [], "verification": { "available": false, "mode": "none" }, "setupLinks": [], "notes": "Email/password remains available." },
        { "id": "google", "name": "Google", "status": "development-verified", "delivery": "baseline", "selectable": true, "credentials": ["GOOGLE_CLIENT_ID", "GOOGLE_CLIENT_SECRET"], "bindings": [], "dependencies": [], "verification": { "available": true, "mode": "oauth-flow" }, "setupLinks": ["https://console.cloud.google.com/auth/clients"], "notes": "Real validation requires the deployed authorization and callback flow." },
        { "id": "github", "name": "GitHub", "status": "implemented", "delivery": "baseline", "selectable": true, "credentials": ["GITHUB_CLIENT_ID", "GITHUB_CLIENT_SECRET"], "bindings": [], "dependencies": [], "verification": { "available": true, "mode": "oauth-flow" }, "setupLinks": ["https://github.com/settings/developers"], "notes": "Requests verified email access." },
        { "id": "apple", "name": "Apple", "status": "implemented", "delivery": "baseline", "selectable": true, "credentials": ["APPLE_CLIENT_ID", "APPLE_TEAM_ID", "APPLE_KEY_ID", "APPLE_PRIVATE_KEY_BASE64", "APPLE_APP_BUNDLE_IDENTIFIER"], "bindings": [], "dependencies": ["jose"], "verification": { "available": true, "mode": "oauth-flow" }, "setupLinks": ["https://developer.apple.com/account/resources/identifiers/list/serviceId"], "notes": "Web and native audience configuration remain explicit." }
      ]
    },
    {
      "id": "email", "name": "Authentication email", "kind": "provider", "required": true, "selection": "single", "defaultOptionIds": ["cfsend"], "capabilityIds": ["identity.core"],
      "options": [
        { "id": "cfsend", "name": "CFsend", "status": "development-verified", "delivery": "baseline", "selectable": true, "credentials": ["CFSEND_API_URL", "CFSEND_API_KEY", "CFSEND_FROM"], "bindings": [], "dependencies": [], "verification": { "available": true, "mode": "delivery" }, "setupLinks": ["https://send.all2cf.com/dashboard"], "notes": "Default provider with real message-ID and retry evidence." },
        { "id": "resend", "name": "Resend", "status": "local-verified", "delivery": "baseline", "selectable": true, "credentials": ["RESEND_API_KEY", "RESEND_FROM"], "bindings": [], "dependencies": [], "verification": { "available": true, "mode": "delivery" }, "setupLinks": ["https://resend.com/api-keys", "https://resend.com/domains"], "notes": "HTTP adapter using the same outbox and idempotency contract." },
        { "id": "cloudflare-email", "name": "Cloudflare Email Service", "status": "implemented", "delivery": "baseline", "selectable": true, "credentials": ["CLOUDFLARE_EMAIL_FROM"], "bindings": ["EMAIL"], "dependencies": [], "verification": { "available": true, "mode": "live-binding" }, "setupLinks": ["https://dash.cloudflare.com/?to=/:account/email-service/sending"], "notes": "Requires the deployed Worker EMAIL binding." }
      ]
    },
    {
      "id": "billing", "name": "Billing", "kind": "provider", "required": false, "selection": "single", "defaultOptionIds": ["none"], "capabilityIds": ["billing.subscriptions"],
      "options": [
        { "id": "none", "name": "None", "status": "implemented", "delivery": "baseline", "selectable": true, "credentials": [], "bindings": [], "dependencies": [], "verification": { "available": false, "mode": "none" }, "setupLinks": [], "notes": "No paid plans or provider runtime." },
        { "id": "stripe", "name": "Stripe", "status": "development-verified", "delivery": "materializer", "selectable": true, "credentials": ["STRIPE_SECRET_KEY", "STRIPE_PUBLISHABLE_KEY", "STRIPE_WEBHOOK_SECRET", "STRIPE_PRICE_PRO"], "bindings": [], "dependencies": ["stripe", "@better-auth/stripe"], "verification": { "available": true, "mode": "contract" }, "setupLinks": ["https://dashboard.stripe.com/test/apikeys"], "notes": "Test and Live credentials remain separate." }
      ]
    },
    {
      "id": "object-storage", "name": "Object storage", "kind": "provider", "required": false, "selection": "single", "defaultOptionIds": ["none"], "capabilityIds": ["storage.objects"],
      "options": [
        { "id": "none", "name": "None", "status": "implemented", "delivery": "baseline", "selectable": true, "credentials": [], "bindings": [], "dependencies": [], "verification": { "available": false, "mode": "none" }, "setupLinks": [], "notes": "No file-byte storage; metadata-only seams remain inactive." },
        { "id": "cloudflare-r2", "name": "Cloudflare R2", "status": "local-verified", "delivery": "materializer", "selectable": true, "credentials": [], "bindings": ["OBJECTS"], "dependencies": [], "verification": { "available": true, "mode": "round-trip" }, "setupLinks": ["https://dash.cloudflare.com/?to=/:account/r2/overview"], "notes": "Local Wrangler R2 simulation has exact-byte private/public round-trip evidence; Development and Production use isolated buckets." },
        { "id": "s3-compatible", "name": "S3-compatible", "status": "implemented", "delivery": "materializer", "selectable": true, "credentials": ["S3_ACCESS_KEY_ID", "S3_SECRET_ACCESS_KEY"], "bindings": [], "dependencies": ["@aws-sdk/client-s3"], "verification": { "available": true, "mode": "round-trip" }, "setupLinks": ["https://docs.aws.amazon.com/AmazonS3/latest/userguide/Welcome.html"], "notes": "Endpoint, region, bucket and path-style are project configuration. Materialization, types and Worker dry-runs pass; a selected project's real endpoint must pass the explicit round-trip before release." }
      ]
    },
    {
      "id": "anti-abuse", "name": "Anti-abuse", "kind": "provider", "required": false, "selection": "single", "defaultOptionIds": ["none"], "capabilityIds": ["security.turnstile"],
      "options": [
        { "id": "none", "name": "None", "status": "implemented", "delivery": "baseline", "selectable": true, "credentials": [], "bindings": [], "dependencies": [], "verification": { "available": false, "mode": "none" }, "setupLinks": [], "notes": "Public write endpoints remain unprotected by a challenge provider." },
        { "id": "turnstile", "name": "Cloudflare Turnstile", "status": "local-verified", "delivery": "materializer", "selectable": true, "credentials": ["TURNSTILE_SITE_KEY", "TURNSTILE_SECRET_KEY"], "bindings": [], "dependencies": ["better-auth/captcha"], "verification": { "available": true, "mode": "round-trip" }, "setupLinks": ["https://dash.cloudflare.com/?to=/:account/turnstile"], "notes": "Better Auth Captcha enforces server-side Siteverify for credential sign-up, sign-in and password reset; Development and Production use separate widgets." }
      ]
    },
    {
      "id": "observability", "name": "Observability and errors", "kind": "provider", "required": true, "selection": "multiple", "defaultOptionIds": ["cloudflare-observability"], "capabilityIds": ["operations.health"],
      "options": [
        { "id": "cloudflare-observability", "name": "Cloudflare Observability", "status": "development-verified", "delivery": "platform", "selectable": true, "credentials": [], "bindings": [], "dependencies": [], "verification": { "available": true, "mode": "deployment" }, "setupLinks": ["https://dash.cloudflare.com/?to=/:account/workers-and-pages/observability"], "notes": "Structured Worker logs are the baseline." },